<xs:schema attributeFormDefault="unqualified" elementFormDefault="qualified" xmlns:xs="http://www.w3.org/2001/XMLSchema">
  <xs:element name="REIT">
    <xs:complexType>
      <xs:sequence>
        <xs:element name="Warehouse">
          <xs:annotation>
            <xs:documentation>&lt;REIT xmlns:xsi="http://www.w3.org/2001/XMLSchema-instance"
	xsi:noNamespaceSchemaLocation="InitialData.xsd"></xs:documentation>
          </xs:annotation>
          <xs:complexType>
            <xs:sequence>
              <xs:element name="Tools">
                <xs:complexType>
                  <xs:sequence>
                    <xs:element name="Tool" maxOccurs="unbounded" minOccurs="0">
                      <xs:complexType>
                        <xs:sequence>
                          <xs:element type="xs:string" name="Name"/>
                          <xs:element type="xs:byte" name="Quantity"/>
                        </xs:sequence>
                      </xs:complexType>
                    </xs:element>
                  </xs:sequence>
                </xs:complexType>
              </xs:element>
              <xs:element name="Materials">
                <xs:complexType>
                  <xs:sequence>
                    <xs:element name="Material" maxOccurs="unbounded" minOccurs="0">
                      <xs:complexType>
                        <xs:sequence>
                          <xs:element type="xs:string" name="Name"/>
                          <xs:element type="xs:short" name="Quantity"/>
                        </xs:sequence>
                      </xs:complexType>
                    </xs:element>
                  </xs:sequence>
                </xs:complexType>
              </xs:element>
            </xs:sequence>
          </xs:complexType>
        </xs:element>
        <xs:element name="Staff">
          <xs:complexType>
            <xs:sequence>
              <xs:element name="Clerks">
                <xs:complexType>
                  <xs:sequence>
                    <xs:element name="Clerk" maxOccurs="unbounded" minOccurs="0">
                      <xs:complexType>
                        <xs:sequence>
                          <xs:element type="xs:string" name="Name"/>
                          <xs:element name="Location">
                            <xs:complexType>
                              <xs:simpleContent>
                                <xs:extension base="xs:string">
                                  <xs:attribute type="xs:byte" name="x" use="optional"/>
                                  <xs:attribute type="xs:byte" name="y" use="optional"/>
                                </xs:extension>
                              </xs:simpleContent>
                            </xs:complexType>
                          </xs:element>
                        </xs:sequence>
                      </xs:complexType>
                    </xs:element>
                  </xs:sequence>
                </xs:complexType>
              </xs:element>
              <xs:element type="xs:byte" name="NumberOfMaintenancePersons"/>
              <xs:element type="xs:byte" name="TotalNumberOfRentalRequests"/>
            </xs:sequence>
          </xs:complexType>
        </xs:element>
      </xs:sequence>
    </xs:complexType>
  </xs:element>
</xs:schema>